title,body,date,url,source,image,compound
The company Expands into Education Financing,Affirm is a financial services technology company that is reimagining consumer finance by providing consumers new and innovative ways of financing their...,2015-07-14,https://www.businesswire.com/news/home/20150714006296/en/Affirm-Expands-into-Education-Financing,Business Wire,https://audiospace-1-u9912847.deta.app/getnewspic?id=vqw36xaV9x0wBV3zuafN1701422074.8573294,0.36523789500000003
Fintech startup The company's IPO filing shows revenue surge amid ...,"(Reuters) - Lending startup Affirm Holdings Inc disclosed its application ... The company, founded by PayPal Holdings Inc PYPL.O co-founder Max Levchin...",2020-11-18,https://www.reuters.com/article/us-affirm-ipo-idUKKBN27Y30R,Reuters,https://audiospace-1-u9912847.deta.app/getnewspic?id=6kiS0VqRTmy8qbXPFmeW1701422074.9124937,0.440160662
Be Cautious With The company in a Rising-Rate Environment,"Affirm stock has shot up in recent days, but be careful with Federal Reserve interest rates on the rise. The buy-now-pay-later (BNPL) company Affirm (AFRM...",2022-05-19,https://www.fool.com/investing/2022/05/19/be-cautious-with-affirm-in-a-rising-rate-environme/,The Motley Fool,https://audiospace-1-u9912847.deta.app/getnewspic?id=goauvYY6fvMcxJpKQHfU1701422074.960088,0.258191031
"The company shares fall on report Apple is working with Goldman Sachs to offer buy now, pay later service","Affirm shares fall on report Apple is working with Goldman Sachs to offer buy now, pay later service ... Apple CEO Tim Cook attends the Allen & Company Sun Valley...",2021-07-13,https://www.cnbc.com/2021/07/13/apple-reportedly-working-on-buy-now-pay-later-service-with-goldman-sachs.html,CNBC,https://audiospace-1-u9912847.deta.app/getnewspic?id=NsrqWJQFpT0ZgICYmquD1701422075.018498,0.025242195857142862
"The company's 'super-app' ambitions win praise as company plots debit, crypto moves",Referenced Symbols ... Affirm Holdings Inc. is joining the ranks of fintech companies vying for “super-app” status as the company plans a series of feature...,2021-09-30,https://www.marketwatch.com/story/affirms-super-app-ambitions-win-praise-as-company-plots-debit-crypto-moves-11632949669,MarketWatch,https://audiospace-1-u9912847.deta.app/getnewspic?id=4nyT9R0DYyv9DYiMUgB01701422075.0633504,0.39402654559999994
How online loans like The company and Afterpay really work—and should you ever use them,Then they learned that Peloton offers low-interest financing through the financial technology company Affirm. “My husband and I decided to finance because...,2019-06-06,https://www.cnbc.com/2019/06/06/how-affirm-afterpay-online-loans-work.html,CNBC,https://audiospace-1-u9912847.deta.app/getnewspic?id=oS9YJzmI8IlMku1NziCu1701422074.0745857,0.39359468866666675
"Hologic, Inc. - Hologic to Showcase Portfolio of ...","New Affirm® Contrast Biopsy Technology Included in the Screening, Diagnosis ... Inc., and/or its subsidiaries in the United States and/or other countries...",2022-11-25,https://investors.hologic.com/press-releases/press-release-details/2022/Hologic-to-Showcase-Portfolio-of-Comprehensive-Breast-and-Skeletal-Health-Solutions-at-RSNA-2022/default.aspx,"Hologic, Inc. - Investor Relations",https://audiospace-1-u9912847.deta.app/getnewspic?id=xlL4FMsCBbLVlElaEwTm1701422074.1232193,0.0
The company Stock Rose. An Exclusivity Deal With Amazon.com Ended.,The company is set to report second-quarter financial results on Feb. 8 after the market close. Barron's Newsletters. The Barron's Daily. A morning briefing on...,2023-01-31,https://www.barrons.com/articles/affirm-stock-price-amazon-buy-now-pay-later-deal-51675202564,Barron's,https://audiospace-1-u9912847.deta.app/getnewspic?id=vHGrp7QGoZ9DMJijkR4G1701422074.1710413,0.200935065
BNPL Company The company Rolls out Adaptive Checkout,"BNPL Company Affirm Rolls out Adaptive Checkout ... The buy now, pay later (BNPL) network Affirm has launched a new product called Adaptive Checkout, which it...",2021-09-22,https://www.pymnts.com/buy-now-pay-later/2021/bnpl-company-affirm-rolls-out-adaptive-checkout/,PYMNTS.com,https://audiospace-1-u9912847.deta.app/getnewspic?id=np3OSTOotWf5nt5TTZ8j1701422074.2467844,-0.03431128766666666
"Walmart does away with layaway, announcing buy now, pay later program","The company announced it's using Affirm, a buy now, pay later service the retailer partnered with in 2019. Walmart started to phase its layaway out last...",2021-09-27,https://www.businessinsider.com/walmart-layaway-canceled-affirm-finance-buy-now-pay-later-2021-9,Business Insider,https://audiospace-1-u9912847.deta.app/getnewspic?id=ki3AwXe0WKMnRtPazy3s1701422074.3541973,0.014360028999999996
The company embeds with Apple Pay for instore financing,"Source: Affirm. Affirm, Inc., the company started by entrepreneur Max Levchin to provide fair and honest financial products, today announced Affirm will...",2018-03-21,https://www.finextra.com/pressarticle/73141/affirm-embeds-with-apple-pay-for-instore-financing,Finextra Research,https://audiospace-1-u9912847.deta.app/getnewspic?id=BGibLU2hKeIP0kfQvnvR1701422074.4044044,0.10025308
"The company CEO: 'Buy now, pay later' becomes more attractive in a slump",Affirm's stock soared in its trading debut as the company blazed a trail for a fast-growing alternative to the credit cards that Levchin says consumers are...,2022-06-28,https://www.protocol.com/fintech/affirm-inflation-rates,Protocol,https://audiospace-1-u9912847.deta.app/getnewspic?id=EOeXqzPzh1ajduYfKvKc1701422074.5936031,0.08272858966666667
"The company's Bad News 'Likely Isn't as Bad,' Analyst Says. He Cut His Price Target.","Affirm's Bad News 'Likely Isn't as Bad,' Analyst Says. He Still Cut His Price Target. By ... Copyright © 2023 Dow Jones & Company, Inc. All Rights Reserved.",2022-09-07,https://www.barrons.com/articles/affirms-bad-news-likely-isnt-as-bad-analyst-says-he-still-cut-his-price-target-51662551658,Barron's,https://audiospace-1-u9912847.deta.app/getnewspic?id=EzgqZpL7zNzpuQpAaGAk1701422074.6976762,-0.14557044400000002
"Should You Buy Now, Pay Later? Tread Carefully. (Published ...","It depends. In general, buy now, pay later programs from companies like Afterpay, Affirm, Klarna and Zip look identical, but they have important differences.",2022-06-23,https://www.nytimes.com/2022/06/22/technology/personaltech/buy-now-pay-later-afterpay-klarna-affirm.html,The New York Times,https://audiospace-1-u9912847.deta.app/getnewspic?id=POTi2Mg7gsmTtWZYgoqG1701422074.7419908,0.07655170766666668
"The company And American Airlines Team Up on Buy Now, Pay Later","By Sam Boughedda. Investing.com — Buy now, pay later has arrived in the travel industry. Affirm Holdings Inc (NASDAQ:AFRM) announced Wednesday that it has...",2021-10-27,https://finance.yahoo.com/news/affirm-american-airlines-team-buy-095435801.html,Yahoo Finance,https://audiospace-1-u9912847.deta.app/getnewspic?id=kyn5XdOVoSLDmbmHpjN11701422081.1233559,0.12013563
Stripe Offers The company’s Adaptive Checkout to Canadian Users,"Ticket Platform SeatGeek Teams With Affirm. Payments company Stripe and buy now, pay later (BNPL) provider Affirm have expanded their partnership. According...",2023-04-13,https://www.pymnts.com/bnpl/2023/stripe-offers-affirms-adaptive-checkout-to-canadian-users/,PYMNTS.com,https://audiospace-1-u9912847.deta.app/getnewspic?id=n4TqwOpB84fXa8vUhGkG1701422081.1725366,0.1349913305
"The company, Okta bulk up in Chicago","In one recent deal, online consumer-lending company Affirm leased 57,000 square feet at 350 N. ... Crain Communications, Inc. All Rights Reserved. Some U.S....",2020-02-20,https://www.chicagobusiness.com/commercial-real-estate/west-coast-tech-firms-bulk-chicago,Crain's Chicago Business,https://audiospace-1-u9912847.deta.app/getnewspic?id=zUzgZZOPqyC05rfq1u1s1701422081.2253041,0.14001818
"Amazon strikes a deal with The company, the buy-now pay-later ...","Once approved, customers will be able to see the total purchase price upfront — and they won't be charged any late or hidden fees, the company said. The service...",2021-08-30,https://www.nytimes.com/2021/08/27/business/amazon-affirm.html,The New York Times,https://audiospace-1-u9912847.deta.app/getnewspic?id=DIz05RgcIbSYEagLkVzn1701422081.271431,-0.424607781
"The company Holdings, Inc. (NASDAQ:AFRM) is largely controlled by ...","Yahoo Finance · Affirm Holdings, Inc. (NASDAQ:AFRM) is largely controlled by institutional shareholders who own 63% of the company.",2023-05-15,https://finance.yahoo.com/news/affirm-holdings-inc-nasdaq-afrm-100950953.html,Yahoo Finance,https://audiospace-1-u9912847.deta.app/getnewspic?id=VBHMJbc6UYkRwtgWVMnF1701422081.489424,0.192192596
"Midday Movers: Dell Technologies, The company, Moderna and More ...","Affirm Holdings Inc (NASDAQ:AFRM) shares fell 20% after the buy-now-pay-later fintech lowered its full year revenue outlook, also highlighting economic...",2022-08-26,https://www.investing.com/news/stock-market-news/midday-movers-dell-technologies-affirm-moderna-and-more-2881102,Investing.com,https://audiospace-1-u9912847.deta.app/getnewspic?id=ivHz8UKcQ6hNMqrJXhzL1701422081.6127286,0.0
The rapid evolution of buy now/pay later loans,"The Sweden-based company laid off 10% of its workforce but also raised $800 ... Affirm, which was valued at more than $30 billion last year, now hovers...",2022-12-27,https://www.americanbanker.com/payments/list/the-rapid-evolution-of-buy-now-pay-later-loans,American Banker,https://audiospace-1-u9912847.deta.app/getnewspic?id=BbyjlgvPdzdcuXLL9pzf1701422081.659577,0.28401250850000004
The company stock rockets more than 90% after IPO,Affirm Holdings Inc. shares have nearly doubled in midday trading Wednesday after the financial-technology company made its public debut. Shares of Affirm...,2021-01-13,https://www.marketwatch.com/story/affirm-stock-rockets-after-ipo-11610558856,MarketWatch,https://audiospace-1-u9912847.deta.app/getnewspic?id=6xVpxGURGREYuBqhbXJI1701422081.726215,0.0
"The company spinout Resolve raises $25M in Insight Partners-led round to grow B2B buy now, pay later offering","The investment comes just months after the company secured a combined $60 million asset and equity financing (the majority of which was asset, or debt). Insight...",2021-12-09,https://techcrunch.com/2021/12/09/affirm-spinout-resolve-raises-25m-in-insight-partners-led-round-to-grow-b2b-buy-now-pay-later-offering/,TechCrunch,https://audiospace-1-u9912847.deta.app/getnewspic?id=RHi7sWC8di4187iQ8UxQ1701422081.795715,0.22294392249999997
Shopify Rolls Out The company's Installment Payment Service to All U.S. Merchants,"The consumer payments company Affirm Holdings on Thursday said that it is rolling out its “buy now, pay later” installment payment service as an option to...",2021-06-10,https://www.barrons.com/articles/shopify-affirm-installment-payment-service-51623326082,Barron's,https://audiospace-1-u9912847.deta.app/getnewspic?id=qLLH3D17N8E5QgPLrnqI1701422081.2019734,-0.033583504
Max Levchin's The company boosts IPO price range as it looks to raise ...,"Jan 11 (Reuters) - Lending startup Affirm Holdings Inc, founded by PayPal Holdings Inc PYPL.O co-founder Max Levchin, said on Monday it aims to raise as...",2021-01-11,https://www.nasdaq.com/articles/max-levchins-affirm-boosts-ipo-price-range-as-it-looks-to-raise-$1.08-bln-2021-01-11,Nasdaq,https://audiospace-1-u9912847.deta.app/getnewspic?id=x1rFmSJKw0YcZsrrv5491701422081.4675722,0.28133194
"Why Block, The company, and Upstart Holdings Were Plunging Today","His clients may own shares of the companies mentioned. The Motley Fool has positions in and recommends Affirm Holdings, Inc., Bitcoin, Block, Inc., and Upstart...",2022-11-21,https://www.fool.com/investing/2022/11/21/why-block-affirm-and-upstart-holdings-were-plungin/,The Motley Fool,https://audiospace-1-u9912847.deta.app/getnewspic?id=S3IuXR6QrhO4j4e5BpTa1701422082.0059013,0.016140408499999995
Lending company The company takes on bricks and mortar shopping,"Clover's point-of-sale product, a modern day cash register, lets merchants easily turn on Affirm's service with a few taps on the tablet-like device. Customers...",2015-10-27,https://fortune.com/2015/10/27/affirm-expansion-levchin-loans/,Fortune,https://audiospace-1-u9912847.deta.app/getnewspic?id=t1HQuexqk7gxi2o37Ux11701422082.1805775,0.136198859
The company doubles user base amid inflation,"Buy now, pay later company Affirm has nearly doubled its user base as inflation has more users flocking to modern-day financing services.",2022-08-26,https://www.modernretail.co/technology/affirm-doubles-user-base-amid-inflation/,Modern Retail,https://audiospace-1-u9912847.deta.app/getnewspic?id=1G5PHCuZ2moBPdLhxrF01701422082.266663,-0.25849311350000004
The company FILMS AND PROVIDENT FILMS ANNOUNCE ...,"13, 2023 /PRNewswire/ -- Continuing the 17 year partnership between The Kendrick Brothers and AFFIRM Films, a Sony Pictures Entertainment (SPE) company and...",2023-02-13,https://www.prnewswire.com/news-releases/affirm-films-and-provident-films-announce-production-of-the-next-kendrick-brothers-film-301745794.html,PR Newswire,https://audiospace-1-u9912847.deta.app/getnewspic?id=dcDFQokTR7qUIWa0E3nz1701422082.330022,0.0
Shopify will be a major winner in The company’s IPO,"But in this case, Shopify didn't use its stock price or balance sheets—no, the company leveraged its massive network of merchants to ink out a deal with Affirm.",2020-11-19,https://fortune.com/2020/11/19/shopify-will-be-a-major-winner-in-affirms-ipo/,Fortune,https://audiospace-1-u9912847.deta.app/getnewspic?id=5A6cWTcgUbMNE2VW1NT31701422082.4024966,0.3790615456666666
The company sees 'healthier' tone in ABS after upping size of latest deal,"Affirm debuted in the ABS market in 2020, issuing three deals worth $900m that year. The company issued four deals totaling $1.6bn in 2021, and a further four...",2023-01-23,https://www.globalcapital.com/securitization/article/2b6qpb75lck9p2pd9jldt/securitization/abs/affirm-sees-healthier-tone-in-abs-after-upping-latest-deal,GlobalCapital,https://audiospace-1-u9912847.deta.app/getnewspic?id=R3lx00LYNdfV8Fd2EpV91701422082.4483707,0.054616703
The company hits $100 on opening day after listing at $49 (Updated),The company recently expanded its reach through a partnership with online retail giant Shopify. While Affirm has succeeded in exploiting the popularity of the...,2021-01-13,https://fortune.com/2021/01/13/affirm-goes-public-at-49-ceo-touts-firms-principled-approach-to-credit/,Fortune,https://audiospace-1-u9912847.deta.app/getnewspic?id=yc4IdUrlwQ1gddaeO6y81701422082.498599,0.05200844099999999
"A Tech Titan's Entree to 'Buy Now, Pay Later' is Upsetting the ...","In 2016, Affirm's CEO Max Levchin told Inc. that access to credit is so ... Shares of BNPL companies Affirm and Afterpay have already dropped around 10 percent...",2021-07-16,https://www.inc.com/teresa-xie/apple-buy-now-pay-later-klarna-affirm-afterpay-affirm-bnpl.html,Inc. Magazine,https://audiospace-1-u9912847.deta.app/getnewspic?id=uvtoOQkUNiHieOrtLnQN1701422086.2060163,-0.23440321800000002
3 unconventional benefits got company a 92% approval rating,"So, we sat down with Affirm's Director of Global Benefits Mike Roeding to find out how this buy now, pay later company has a 92% approval rate when it comes to...",2022-07-20,https://www.hrmorning.com/articles/unconventional-benefits-affirm-wallet/,HR Morning,https://audiospace-1-u9912847.deta.app/getnewspic?id=32Nd4S7erKxnJgNBA5tz1701422086.2585888,0.34199478120000004
SOFI: SoFi vs. The company: Which Fintech Stock is a Better Buy?,"Based in San Francisco, SoFi Technologies, Inc. operates as a fintech company that offers various financial services. In addition to cryptocurrency trading,...",2022-01-20,https://stocknews.com/news/sofi-afrm-sofi-vs-affirm-which-fintech-stock-is-a-better-buy/,StockNews.com,https://audiospace-1-u9912847.deta.app/getnewspic?id=Qb5H69xAVhJhfjaS35jU1701422086.307343,0.906288393
The company stock rockets after Square announces $29 billion deal for rival Afterpay,Shares of buy-now pay-later (BNPL) company Affirm Holdings Inc. are surging more than 18% in Monday trading after Square Inc. announced its plans to...,2021-08-02,https://www.marketwatch.com/story/affirm-stock-rockets-after-square-announces-29-billion-deal-for-rival-afterpay-2021-08-02,MarketWatch,https://audiospace-1-u9912847.deta.app/getnewspic?id=xe4E4jBCFh8yf8eHcFwN1701422086.3805223,-0.12449460650000002
AFRM: The company vs. Block: Which Beaten-Down Fintech Stock Is a ...,"Affirm vs. Block: Which Beaten-Down Fintech Stock Is a Better Buy? : AFRM | Affirm Holdings Inc. Cl A News, Ratings, and Charts. AFRM – Affirm (AFRM) and...",2022-02-22,https://stocknews.com/news/afrm-sq-affirm-vs-block-which-beaten-down-fintech-stock-is-a-better/,StockNews.com,https://audiospace-1-u9912847.deta.app/getnewspic?id=pg8orkW6crTuMqXkgeYi1701422086.4644272,-0.085642117
Max Levchin's The company raises $300 million in latest funding round,(Reuters) - PayPal Holdings Inc co-founder Max Levchin's Affirm has raised $300 million in a funding round led by Thrive Capital that included actor Ashton...,2019-04-03,https://www.reuters.com/article/us-affirm-funding-idUSKCN1RF26Q/,Reuters,https://audiospace-1-u9912847.deta.app/getnewspic?id=hMUbPddtyRJNvrpvnpI31701422086.5118845,0.12860412266666668
Is The company's Deal With Shopify Too Good to Be True?,"But despite the deal quickly ramping up, Affirm shares have remained flat, so it's possible the company has given up a little too much for investors' liking. A...",2021-07-02,https://www.fool.com/investing/2021/07/02/is-affirms-deal-with-shopify-too-good-to-be-true/,The Motley Fool,https://audiospace-1-u9912847.deta.app/getnewspic?id=LbBlemWr2WbsLAQpEmpn1701422086.557629,0.37839040300000004
Better Buy: The company vs. American Express,"One fintech that has had an effect on the industry is Affirm Holdings (AFRM 4.18%). This buy now, pay later company had a meteoric rise after its initial public...",2022-04-22,https://www.fool.com/investing/2022/04/22/better-buy-affirm-vs-american-express/,The Motley Fool,https://audiospace-1-u9912847.deta.app/getnewspic?id=wJFLQVsugX52DNXeYDhl1701422086.612007,0.3716896205
"In IPO Pop, The company Doubles In Value To $24 Billion","Founded in 2012, Affirm lets people buy everything from shirts to car tires and pay them off in regular installments. It charges interest in about half of its...",2021-01-13,https://www.forbes.com/sites/jeffkauflin/2021/01/13/in-ipo-pop-affirm-doubles-in-value-to-24-billion/,Forbes,https://audiospace-1-u9912847.deta.app/getnewspic?id=z9mru3XB5F8aMw4GtMIQ1701422086.660233,0.09589192999999999
The company Waiving Outstanding Loan Balances in Australia for ...,"Pelo Buddy is in no way affiliated with Peloton Cycle or Peloton Interactive. Peloton is a registered trademark of Peloton Interactive, Inc. Some links on the...",2023-03-21,https://www.pelobuddy.com/affirm-balance-australia/,Pelo Buddy,https://audiospace-1-u9912847.deta.app/getnewspic?id=DQWiAQCNFXJ01gCc9RYU1701422080.7533329,0.436587166
"The company Vs. Mastercard: Their BNPL Strategy, Who Wins Long ...","Affirm Vs. Mastercard: A Deep Dive Into The Differences In BNPL Strategy And Who Wins Long-Term. Jan. 19, 2022 7:46 AM ETAffirm Holdings, Inc. (AFRM), MA41...",2022-01-19,https://seekingalpha.com/article/4480286-affirm-vs-mastercard-deep-dive-differences-in-bnpl-strategy-and-who-wins-long-term,Seeking Alpha,https://audiospace-1-u9912847.deta.app/getnewspic?id=GNRaltbOEMe0fw8saSOi1701422080.994363,0.302908648
Everything You Need to Know About The company | Personal Loans ...,"If you qualify for one of these short-term loans, you will choose a payment schedule and then pay at affirm.com or in the Affirm app. The company promises that...",2023-03-03,https://money.usnews.com/loans/personal-loans/articles/everything-you-need-to-know-about-affirm,U.S. News - Money,https://audiospace-1-u9912847.deta.app/getnewspic?id=8LTgcJ3M6v4XFfadDYFe1701422081.4000776,-0.012025557000000001
Fintech company The company opens Chicago office with 350 North ...,"Fintech company Affirm opens Chicago office with 350 North Orleans lease ... EQ Office announced that Affirm, Inc. will be opening its first Chicago office at 350...",2020-03-15,https://rejournals.com/fintech-company-affirm-opens-chicago-office-with-350-north-orleans-lease/,REJournals,https://audiospace-1-u9912847.deta.app/getnewspic?id=Ad696uSfN9CRqlHP6vpy1701422081.6727638,-0.066210086
US-based fintech firm The company lays off 19% of workforce,"US-based financial technology company Affirm has laid off 19% of its workforce, the company announced in its second-quarter earnings report. Elevate Your...",2023-02-09,https://economictimes.indiatimes.com/tech/technology/us-based-fintech-firm-affirm-lays-off-19-of-workforce/articleshow/97764672.cms,The Economic Times,https://audiospace-1-u9912847.deta.app/getnewspic?id=7nObyIlTmGOffhBMUffd1701422081.7960649,-0.11163301766666667
Is The company Stock a Buy?,"Share prices have declined 93% from their peak, and many shareholders are left wondering what the future holds for the company. Fortunately, Affirm's tale hasn'...",2023-04-25,https://www.fool.com/investing/2023/04/25/is-affirm-stock-a-buy/,The Motley Fool,https://audiospace-1-u9912847.deta.app/getnewspic?id=ZLymm4ob3Bh22K4JK6rT1701422081.8977833,0.0
"Stocks making the biggest moves after hours: Disney, Beyond Meat, The company Holdings and more","Affirm Holdings — Shares of Affirm , the digital “buy now, pay later” company, soared more than 21% in after-hours trading on Wednesday, after the company said...",2021-11-10,https://www.cnbc.com/2021/11/10/stocks-making-the-biggest-moves-after-hours-disney-beyond-meat-affirm-holdings-and-more.html,CNBC,https://audiospace-1-u9912847.deta.app/getnewspic?id=IZj86hFuybBHzyJ32e491701422082.06879,0.1653907535
Best Legal Departments: The company Associate GC Ryan Chen ...,"It's been a meteoric rise for San Francisco-based fintech Affirm and for Ryan Chen, the associate general counsel at the company who has played a pivotal...",2022-11-15,https://www.law.com/corpcounsel/2022/11/15/best-legal-departments-affirm-associate-gc-ryan-chen-plays-indispensable-role/,Law.com,https://audiospace-1-u9912847.deta.app/getnewspic?id=EF99IGkSu08RFezirjAh1701422082.1821823,0.7815200105
"Fintech Layoffs: PayPal, The company Among Companies Cutting ...",Thousands of employees in the nascent financial-technology industry are losing their jobs as companies cut costs for the first time. Affirm Holdings Inc.,2023-02-10,https://www.bloomberg.com/news/articles/2023-02-10/financial-technology-workers-slammed-by-thousands-of-job-cuts,Bloomberg.com,https://audiospace-1-u9912847.deta.app/getnewspic?id=wi20Ra7HRpQfYsGQwcaL1701422082.2584925,-0.22627713200000002
"The company, Agoda to Provide BNPL Travel Booking","Affirm works with more than 200,000 retailers offering buy now, pay later options to customers. The company insists it is different than some companies that...",2022-06-13,https://www.pymnts.com/travel-payments/2022/affirm-agoda-to-provide-bnpl-travel-booking/,PYMNTS.com,https://audiospace-1-u9912847.deta.app/getnewspic?id=WyyRBEJKZxYSJsPoQ0uf1701422089.0625052,0.117922934
"The company: All Out To Grow Revenues, Amazon Deal Could Be ...","Affirm: All Out To Grow Its Revenues, Amazon Deal Could Be Costly. Nov. 15, 2021 9:00 AM ETAffirm Holdings, Inc. (AFRM)31 Comments 10 Likes. Michael Wiggins...",2021-11-15,https://seekingalpha.com/article/4469457-affirm-q1-earnings-growing-revenues-amazon-deal-costly,Seeking Alpha,https://audiospace-1-u9912847.deta.app/getnewspic?id=43Xk3BEl0Gm8Cg5uH2Nb1701422089.1065023,0.004366014000000001
Wall Street hugs The company as it starts life as a public company,"We care about all of that as it's important to realize that Affirm is not a software company in the context that we usually think about them, namely software as...",2021-01-13,https://techcrunch.com/2021/01/13/wall-street-hugs-affirm-as-it-starts-life-as-a-public-company/,TechCrunch,https://audiospace-1-u9912847.deta.app/getnewspic?id=9nZbkxuaSbQ4k4FKZ1q21701422089.1695006,0.13976655300000002
The company's IPO Filing Reveals Nearly A Third Of Its Revenue ...,"Prior to taking the helm of Affirm, Levchin was most known for co-founding PayPal with Peter Thiel in 2000. The San Francisco-based company raised about $1.5...",2020-11-18,https://news.crunchbase.com/venture/affirm-s1-ipo/,Crunchbase News,https://audiospace-1-u9912847.deta.app/getnewspic?id=sdzbChIuJl5Jb3dwSVqU1701422089.2826738,0.117922934
PayPal Co-Founder Max Levchin Gave a Remarkably Honest ...,"Affirm lends money to make purchases. It's like a credit card, but less risky for customers. ... The personal loans startup Affirm offers a straightforward...",2017-12-18,https://www.inc.com/sonya-mann/max-levchin-affirm-misunderstood.html,Inc. Magazine,https://audiospace-1-u9912847.deta.app/getnewspic?id=StQ8TZb9tDHeovbPeN8B1701422089.485815,0.49027057749999997
Wayfair Partners with The company to Offer Shoppers More ...,"BOSTON--(BUSINESS WIRE)--Wayfair Inc. (NYSE:W), one of the world's largest online destinations for home furnishings and décor, today announced a new,...",2016-10-27,https://www.businesswire.com/news/home/20161027005408/en/Wayfair-Partners-with-Affirm-to-Offer-Shoppers-More-Accessible-Financing-Option,Business Wire,https://audiospace-1-u9912847.deta.app/getnewspic?id=z51P9naDqU5hBlpqHYMA1701422089.603432,0.29284743550000003
The company Says Merchants OK With Interest Rate Hikes,"Affirm is raising interest rates on its buy now, pay later loans. In an interview with Bloomberg News on Friday (Feb. 17), CEO Max Levchin said the company...",2023-02-19,https://www.pymnts.com/buy-now-pay-later/2023/affirm-gets-merchant-ok-to-hike-interest-rates/,PYMNTS.com,https://audiospace-1-u9912847.deta.app/getnewspic?id=GojgA9gC6dG3VUs7wsVp1701422089.6498153,0.14252989233333332
