title,body,date,url,source,image,compound
Why The company CEO Max Levchin has not sold a single share of ...,"Financial services is what I'm good at,"" Levchin explained. Affirm is now 10 years old. The company went public in early January 2021. Shares priced at $49,...",2022-03-22,https://finance.yahoo.com/news/why-affirms-founder-max-levchin-has-not-sold-a-single-share-of-his-stock-165919406.html,Yahoo Finance,https://audiospace-1-u9912847.deta.app/getnewspic?id=7ZZGJup5Ey8WuGcRTspf1701422093.5501192,-0.0804806164
Better Buy: SoFi or The company?,"The company offers checking and savings accounts, online-investing capabilities, credit cards, mortgages, personal loans, student loan refinancing, and personal...",2022-09-07,https://www.fool.com/investing/2022/09/07/better-buy-sofi-or-affirm/,The Motley Fool,https://audiospace-1-u9912847.deta.app/getnewspic?id=KRSAK8q9V6bHYEYE9bIP1701422092.3646047,0.906288393
Deputy Appoints Silvija Martincevic as CEO to Further ...,"Before Deputy, Martincevic served as Chief Commercial Officer at Affirm Inc., a fintech company based in San Francisco, where she grew the company's...",2023-02-07,https://www.newswire.com/news/deputy-appoints-silvija-martincevic-as-ceo-to-further-advance-global-21949795,Newswire.com,https://audiospace-1-u9912847.deta.app/getnewspic?id=shxZ44f2xOHvef0wd96w1701422092.4064715,0.117922934
Earnings Preview: The company Holdings (AFRM) Q3 Earnings ...,"This widely-known consensus outlook gives a good sense of the company's earnings picture, but how the actual results compare to these estimates is a powerful...",2023-05-02,https://finance.yahoo.com/news/earnings-preview-affirm-holdings-afrm-140102353.html,Yahoo Finance,https://audiospace-1-u9912847.deta.app/getnewspic?id=cQkjcPbvURUGLvAxWqh11701422092.4769673,0.0
"Financial Institutions Must Address 'Buy Now, Pay Later ...",... company Affirm now originates close to $1 billion in loans annually solely for upscale exercise equipment company Peloton. That one client relationship...,2021-08-23,https://thefinancialbrand.com/news/payments-trends/buy-now-pay-later/financial-institutions-must-address-buy-now-pay-later-trend-fintech-120524/,The Financial Brand,https://audiospace-1-u9912847.deta.app/getnewspic?id=0fYScD8PYlMB0SXUin0W1701422092.5229156,0.169234954
"Many young people prefer ‘buy now, pay later’ to credit cards—here’s why","From Klarna to Affirm to Afterpay, various “buy now, pay later” services are ... Company Logo. Residents of California, Connecticut, Colorado, Utah or...",2022-10-27,https://www.cnbc.com/2022/10/27/gen-z-and-millennials-prefer-buy-now-pay-later-services.html,CNBC,https://audiospace-1-u9912847.deta.app/getnewspic?id=WbPxMchIz6VWjEvq2br51701422092.6190395,0.24536786000000002
"The company Review 2023: Buy Now, Pay Later","Founded in 2012, Affirm is a financial technology company headquartered in San Francisco. Over the past decade, Affirm has built up trust within the...",2023-01-26,https://www.thepennyhoarder.com/debt/affirm-review/,The Penny Hoarder,https://audiospace-1-u9912847.deta.app/getnewspic?id=8e4F36jokmS4gixX8AQG1701422092.7599592,0.10908800699999999
The company's CFO lays out the future of BNPL as investors start ...,I sat down this week with Affirm CFO Michael Linford—a few days after the company reported earnings. He expressed a similar sentiment in terms of investor...,2022-09-01,https://fortune.com/2022/09/01/affirms-cfo-future-bnpl/,Fortune,https://audiospace-1-u9912847.deta.app/getnewspic?id=eWEa2VF3hNHH3WuhFKgy1701422092.7997065,-0.08011654525
Lender The company soars in public debut: Here's how the stock is ...,Shares of financial tech company Affirm (AFRM) soared 98% to close at $97.24 on its first day of trading. The stock opened on Wednesday at $90.90 a share...,2021-01-13,https://finance.yahoo.com/news/lender-affirm-goes-public-heres-how-the-stock-is-doing-173825491.html,Yahoo Finance,https://audiospace-1-u9912847.deta.app/getnewspic?id=XJRZQv9ousyV1g5rvr0m1701422092.8471358,-0.071533022
Top 15 The company Competitors and Alternatives,"Affirm is a publicly traded fintech firm based in San Francisco, California. The company was founded in 2012 by Max Levchinto offer buy now, pay later (BNPL)...",2022-07-05,https://bstrategyhub.com/affirm-competitors-and-alternatives/,Business Strategy Hub,https://audiospace-1-u9912847.deta.app/getnewspic?id=AffjieoTxViBV0BUTIzw1701422092.8962803,0.08814052399999997
"156 UN nations The company West Bank settlements, east J'lem not ...","156 UN nations affirm West Bank settlements, east J'lem not part of Israel. By TOVAH LAZAROFF Published: NOVEMBER 19, 2020 09:59 ... Inc. Designed by DANIEL CHEN.",2020-11-19,https://www.jpost.com/general-assembly/156-un-nations-affirm-west-bank-settlements-east-jlem-not-part-of-israel-649570,The Jerusalem Post,https://audiospace-1-u9912847.deta.app/getnewspic?id=s92BMie3SKts0PApvgVV1701422095.532982,-0.37573849049999997
Financial Technology (Fintech): Its Uses and Impact on Our ...,"For example, financial company Affirm seeks to cut credit card companies out of the online shopping process by offering a way for consumers to secure...",2017-03-25,https://www.investopedia.com/terms/f/fintech.asp,Investopedia,https://audiospace-1-u9912847.deta.app/getnewspic?id=7L85912uxUVzlbxp9Kll1701422095.581631,0.13424713
"Microsoft Payment & Financing Options for Surface, PCs & More",Company. Careers · About Microsoft · Company news · Privacy at Microsoft · Investors · Diversity and inclusion · Accessibility · Sustainability · English (...,2021-06-20,https://www.microsoft.com/en-us/store/b/payment-financing-options,Microsoft,https://audiospace-1-u9912847.deta.app/getnewspic?id=zpYjeKkPWs2oOOgHWIWc1701422095.8005688,0.0344518975
Dutch Senate calls to The company Jewish ties to Temple Mount,"Dutch Senate calls to affirm Jewish ties to Temple Mount. By LAHAV HARKOV Published: NOVEMBER 11, 2020 21:39 Dutch Ambassador to ... Inc. Designed by DANIEL CHEN.",2020-11-11,https://www.jpost.com/international/dutch-senate-reject-un-resolutions-denying-jewish-ties-to-temple-mount-648764,The Jerusalem Post,https://audiospace-1-u9912847.deta.app/getnewspic?id=HcdxaUfYlVtvFe0KwAZ61701422095.9639058,0.108169428
"EU, US The company Lebanon support, diverging from Saudi","EU, US affirm Lebanon support, diverging from Saudi. By REUTERS Published: NOVEMBER 8, 2017 17:15. share Twitter; share email; share ... Inc. Designed by DANIEL...",2017-11-08,https://www.jpost.com/breaking-news/eu-us-affirm-lebanon-support-diverging-from-saudi-513715,The Jerusalem Post,https://audiospace-1-u9912847.deta.app/getnewspic?id=ndnemTx70DyAV0UyXhyh1701422096.0084398,0.337051063
My Chase Plan | Pay Over Time | Chase,"(CIA), a licensed insurance agency, doing business as Chase Insurance Agency Services, Inc. in Florida. Certain custody and other services are provided by...",2020-11-11,https://www.chase.com/personal/credit-cards/mychaseplan-hub,Chase Bank,https://audiospace-1-u9912847.deta.app/getnewspic?id=TBscKlToH7PPQzsUl2eM1701422096.104133,0.194977514
Machine Learning in Finance: 10 Companies to Know,What it does: Affirm is a payment service enabling consumers to finance items and pay for them over time. Consumers agree to the amount upfront so they know...,2021-12-27,https://builtin.com/artificial-intelligence/machine-learning-finance-examples,Built In,https://audiospace-1-u9912847.deta.app/getnewspic?id=z8UcJLpfrAcN3185vj641701422096.1880746,0.178148758
Advertising Non-Discrimination Certification - Charlotte,"Gray Television, Inc. Advertising Non ... The parties to an agreement for the sale of advertising time on a station licensed to Gray Television affirm...",2021-06-14,https://www.wbtv.com/advertising/,WBTV,https://audiospace-1-u9912847.deta.app/getnewspic?id=umckVVt9g2dO5iQe0USi1701422096.2411854,0.0
August | 2019,"... affirm, with no explanation whatever, a District Court judgment resolving ... Inc. v. Iancu, 138 S. Ct. 1348 (2018). Thus, we determine that, if service of a...",2019-08-30,https://patentlyo.com/2019/08,Patently-O,https://audiospace-1-u9912847.deta.app/getnewspic?id=eZ5qkc1I71WMCBICu9nj1701422096.283178,0.0
Kosovo is a test of Israel's moral character,... affirm its commitment to justice and ethics in international relations ... Inc. Designed by DANIEL CHEN.,2020-08-15,https://www.jpost.com/opinion/kosovo-is-a-test-of-israels-moral-character-638784,The Jerusalem Post,https://audiospace-1-u9912847.deta.app/getnewspic?id=Bu0K9zm19csyeiuhEjag1701422101.2895992,0.410850165
"PHOTOS: Massive protest in Washington, D.C.","But when a joint session of Congress meets Wednesday, Jan. 6, to formally affirm ... Inc. Give Light and the People Will Find Their Own Way.",2021-01-06,https://www.ktnv.com/homepage-gallery/photos-unrest-in-washington-d-c,KTNV,https://audiospace-1-u9912847.deta.app/getnewspic?id=aaFVC3vvi4ORBRM8n0vD1701422101.414647,-0.569059516
About,"Its parent, Lookout Local Inc., is a public benefit corporation whose ... We affirm our values in four major ways: We cover all of our diverse communities...",2020-11-23,https://lookout.co/about/,Lookout Santa Cruz,https://audiospace-1-u9912847.deta.app/getnewspic?id=Gs5SgnItASKpR5LFFpc51701422101.5139837,0.0
California Jewish Community fighting to save American ...,"The coalition of Jewish entities urged the House leaders to publicly affirm their commitment to “the foundational elements of our democratic republic."".",2021-01-17,https://www.jpost.com/diaspora/california-jewish-community-fights-for-american-democracy-655739,The Jerusalem Post,https://audiospace-1-u9912847.deta.app/getnewspic?id=edcrU6ApcVt2dmI1up5D1701422101.619536,0.35793432000000003
John Roberts Decides Voting Rights Already Weak Enough ...,"The Supreme Court didn't so much affirm voting rights as it affirmed that ... © 2023 Breaking Media, Inc. All rights reserved. Registration or use of this...",2023-06-08,https://abovethelaw.com/2023/06/john-roberts-voting-rights-allen-milligan/,Above the Law,https://audiospace-1-u9912847.deta.app/getnewspic?id=BORqEi8PMEIRrHH8FKNp1701422101.6908197,0.1178066444
Epic Games Terms of Service,"THE FOLLOWING TERMS AND CONDITIONS (“TERMS”) APPLY TO YOUR USE OF THE WEBSITES OF EPIC GAMES, INC. ... YOU AFFIRM THAT YOU HAVE REACHED THE LEGAL AGE OF MAJORITY...",2018-04-26,https://www.epicgames.com/site/en-US/tos,Epic Games,https://audiospace-1-u9912847.deta.app/getnewspic?id=EKKupDyZEKnLmEEX9RZG1701422101.7949517,-0.0838388815
Best BNPL Apps,"Affirm. See at Affirm. Best for no upfront payment. Klarna. Klarna. See at Klarna ... © 2023 CNET, a Red Ventures company. All rights reserved. US France Germany...",2023-04-26,https://www.cnet.com/personal-finance/loans/personal-loans/best-buy-now-pay-later-apps/,CNET,https://audiospace-1-u9912847.deta.app/getnewspic?id=GKeDRT5vABIwjXbS9UYu1701422101.8554218,0.994916212
January | 2018,"... affirm summarily in a one-word per curiam judgment under Federal Circuit ... Seagate Technology (US) Holdings, Inc., et al., No. 17-787 (Response Requested)...",2018-01-01,https://patentlyo.com/2018/01,Patently-O,https://audiospace-1-u9912847.deta.app/getnewspic?id=skqS65dAQz9WWQ93mbLg1701422101.9233468,0.0
"For first time, Ukrainian Parliament marks int'l Holocaust ...","I am proud to stand here today and to affirm that I, Jonathan, carry on the name of my great-grandfather who was burned in this ... Inc. Designed by DANIEL CHEN.",2020-01-18,https://www.jpost.com/diaspora/antisemitism/for-first-time-ukrainian-parliament-marks-intl-holocaust-remembrance-day-614506,The Jerusalem Post,https://audiospace-1-u9912847.deta.app/getnewspic?id=AKFOGAMxqXwpnkxNNr6A1701422102.00923,0.289701948
Jewish women's org. pushes for US gov't to pass bill ...,"“We affirm our nation's founding principle of religious liberty, which is integrally bound to reproductive freedom. Religious ... Inc. Designed by DANIEL CHEN.",2020-02-14,https://www.jpost.com/american-politics/jewish-womens-org-pushes-for-us-govt-to-pass-bill-protecting-abortion-617580,The Jerusalem Post,https://audiospace-1-u9912847.deta.app/getnewspic?id=JlzKlqspc3dwzPqhjg051701422096.474084,0.0
Watch The Best Christian Movies on Great American Pure Flix,"From Great American Pure Flix Originals like the “God's Not Dead” franchise, “The Case for Christ,” “Strong Fathers, Strong Daughters” and AFFIRM Films...",2023-02-23,https://www.pureflix.com/insider/featured/christian-movies,Pure Flix,https://audiospace-1-u9912847.deta.app/getnewspic?id=6dWJxeDvUWm0KsbNTWzY1701422096.5550075,0.7340219145
"Prisoners to Abbas: Delay elections, nominate Barghouti as VP","“This will affirm Fatah's unity, which is based on the legitimacy of its historic leadership,” the prisoners added ... Inc. Designed by DANIEL CHEN.",2021-04-17,https://www.jpost.com/middle-east/prisoners-to-abbas-delay-elections-nominate-barghouti-as-vp-665405,The Jerusalem Post,https://audiospace-1-u9912847.deta.app/getnewspic?id=AAAEtH1z784I15Be0AcV1701422096.631025,-0.18366786875
41 Top Payment Processing Companies 2023,Sunbit Inc. View Profile · We are hiring. Founded: 2016. Location: Los Angeles ... Affirm also lets customers know upfront the total amount they'll owe and...,2019-01-19,https://builtin.com/fintech/fintech-payments-companies-examples,Built In,https://audiospace-1-u9912847.deta.app/getnewspic?id=l2CtMrNr7MorTDQ4SbPa1701422096.7083805,0.543193195
California Can't Pick Who Runs for President. New Law Just ...,"California is weighing its options, but if it chooses to appeal, the Ninth Circuit should affirm ... The key case on this is U.S. Term Limits, Inc. v. Thornton...",2019-09-24,https://www.heritage.org/election-integrity/commentary/california-cant-pick-who-runs-president-new-law-just-attack-trump,The Heritage Foundation,https://audiospace-1-u9912847.deta.app/getnewspic?id=lXN6ebd6L83H0HOwISNZ1701422096.7835379,0.04366997249999999
LGBTQ Youth Face Higher Rates of Bullying: Affirming ...,The key to reducing the risk is to implement CDC-recommended protective strategies in schools and to affirm LGBTQ identities at home. What the new research...,2021-11-19,https://psychcentral.com/news/lgbtq-students-face-bullying-at-higher-rates-than-their-peers,Psych Central,https://audiospace-1-u9912847.deta.app/getnewspic?id=CE5yAl1zv1IISihoSCgX1701422096.8505871,0.07340262350000001
Terms and Conditions of Use,"By using this website, you affirm that you have had sufficient opportunity ... Copyright. All contents are the copyright © Heartbeat International, Inc. All...",2022-03-01,https://pregnancyhelpnews.com/terms-and-conditions,Pregnancy Help News,https://audiospace-1-u9912847.deta.app/getnewspic?id=6BHx9msYSEyEZ40qHNIS1701422096.9367058,0.1431534285
Joe Biden recognizes 1915 massacres as Armenian Genocide,We affirm the history. We do this not to cast blame but to ensure that what ... Inc. Designed by DANIEL CHEN.,2021-04-24,https://www.jpost.com/breaking-news/biden-says-1915-massacres-of-armenians-constitute-genocide-666227,The Jerusalem Post,https://audiospace-1-u9912847.deta.app/getnewspic?id=gmgTnLgedxeKbatVxiJl1701422097.010682,-0.3475089266666667
"Is It Time to Burst the Buy Now, Pay Later Bubble?","... Affirm, Zip, PayPal, and Afterpay. The probe aims to ensure fair and ... Company News. Get Involved. Recruit With Built In · Subscribe to Our Newsletter · Become...",2022-05-03,https://builtin.com/fintech/bnpl-buy-now-pay-later-regulations,Built In,https://audiospace-1-u9912847.deta.app/getnewspic?id=cpeYQzsiz9jwTqYuIS9O1701422097.0722976,0.10293330525
Terms of Use,"... affirm, represent and warrant that (1) you own or otherwise control all right, title and interest in and to Your Content, including the copyright thereto...",2017-01-28,https://www.eastidahonews.com/terms-of-use/,East Idaho News,https://audiospace-1-u9912847.deta.app/getnewspic?id=lWLKdXcACMdrXWCwtkxb1701422095.659852,0.13424713
Nasrallah: Past year has shifted the war against Israel in our ...,"All these developments, in my opinion, serve in a way affirm our long struggle along the axis of resistance with Israel, the ... Inc. Designed by DANIEL CHEN.",2023-04-14,https://www.jpost.com/middle-east/article-739203,The Jerusalem Post,https://audiospace-1-u9912847.deta.app/getnewspic?id=MA9QdQ0cjc1S3xfYZxT11701422095.7059634,-0.211446158
Here's how California's new voter registration law will work,They'll also be asked to affirm their eligibility to vote and will be given the choice of opting out of registering at that time. Information about anyone...,2015-10-16,https://www.latimes.com/politics/la-me-pol-ca-motor-voter-law-20151016-html-htmlstory.html,Los Angeles Times,https://audiospace-1-u9912847.deta.app/getnewspic?id=UkuSbx8aCuWH2vb2fBs11701422095.7668324,0.30600990075
To save society amid corona the arts need to reopened,"In these times of turmoil, we need to affirm that the arts and culture are essential in a creative society and are crucial for ... Inc. Designed by DANIEL CHEN.",2020-10-26,https://www.jpost.com/opinion/to-save-society-amid-corona-the-arts-need-to-reopened-646661,The Jerusalem Post,https://audiospace-1-u9912847.deta.app/getnewspic?id=ZEy44v6ZnJxxR3ZFsCJd1701422096.0397553,0.075975981
"Elon Musk targets Dr Anthony Fauci in viral tweet, sparking ...","... affirm your pronouns Elon."" Take international news everywhere with you! Download the France 24 app. Republican lawmakers have pledged to grill Fauci when...",2022-12-12,https://www.france24.com/en/americas/20221212-elon-musk-targets-dr-anthony-fauci-in-viral-tweet-sparking-backlash,France 24,https://audiospace-1-u9912847.deta.app/getnewspic?id=wWyiOBRvN5gjFYlXyiwI1701422096.0819676,0.175419613
Religious Zionism plan criticized for 'protecting rapists ...,... affirm that they are aware of potential legal repercussions of filing a ... Inc. Designed by DANIEL CHEN.,2021-03-21,https://www.jpost.com/israel-elections/religious-zionism-plan-criticized-for-protecting-rapists-pedophiles-662574,The Jerusalem Post,https://audiospace-1-u9912847.deta.app/getnewspic?id=p0FmuGtl3VDJlNj38yq91701422096.124425,-0.5094407240000001
UAE supports Saudi position on US Khashoggi report,"The UAE's foreign ministry ""expressed its confidence in and support for the Saudi judiciary rulings, which affirm ... Inc. Designed by DANIEL CHEN.",2021-02-27,https://www.jpost.com/breaking-news/uae-supports-saudi-position-on-us-khashoggi-report-660389,The Jerusalem Post,https://audiospace-1-u9912847.deta.app/getnewspic?id=R1hBW1C067fM3YKjxoy21701422096.1737738,0.4440849005
Weekly Case Digests,"Because Martin shows no “extraordinary and compelling” reason for release, we affirm. ... Inc. (Eagle Cove), appeals from the circuit court's order...",2022-03-25,https://wislawjournal.com/2022/03/25/weekly-case-digests-march-21-2022-march-25-2022-2/,Wisconsin Law Journal,https://audiospace-1-u9912847.deta.app/getnewspic?id=COMp3M3DkTY6bIZ0mXsw1701422096.2598803,0.103055557
Fairfax County School Board commits to supporting ...,"“I'm proud of the policy and regulations we have implemented in Fairfax County Public Schools to protect and affirm our LGBTQIA students, particularly those...",2022-10-10,https://www.ffxnow.com/2022/10/10/fairfax-county-school-board-commits-to-supporting-transgender-students-as-community-speaks-out/,FFXnow,https://audiospace-1-u9912847.deta.app/getnewspic?id=f0ozSGJ5dDXEXpzhbfzp1701422096.3034108,0.35290682650000005
Five things you can do to improve diversity and inclusion at ...,So this is an inefficiency — why should someone need to come forward in a crisis scenarios for a company to take the time to affirm its values? If you were...,2018-07-05,https://www.chicagotribune.com/business/blue-sky/ct-bsi-hub-tom-alexander-diversity-20180705-story.html,Chicago Tribune,https://audiospace-1-u9912847.deta.app/getnewspic?id=pJPAB9h5FJo0lyPyWB131701422104.2583923,0.2963549605
UAE: Palestinian state at '67 lines a must despite peace deal ...,"... affirm our total rejection of the annexation of Palestinian territory, and ... Inc. Designed by DANIEL CHEN.",2020-09-30,https://www.jpost.com/middle-east/uae-palestinian-state-at-67-line-a-must-despite-peace-deal-with-israel-643874,The Jerusalem Post,https://audiospace-1-u9912847.deta.app/getnewspic?id=dZf6JSENiNwvzMPOpBoa1701422104.9206214,0.25866093
"(IBUY) Amplify Online Retail ETF Stock Price, Holdings, Quote ...","Affirm Holdings, Inc. Class A2.83%; Upwork, Inc.2.79%; Vivid Seats Inc. Class A2.63%; TripAdvisor, Inc.2.63%; Hims & Hers Health, Inc. Class A2.57%; Chegg, Inc...",2017-11-06,https://www.etf.com/IBUY,ETF.com,https://audiospace-1-u9912847.deta.app/getnewspic?id=bdjAmIuqILwrVTzWNPQa1701422105.4387734,0.3787369425
Couples desiring to conceive should vaccinate against COVID ...,“It is important to share data and affirm for the population that there is no fertility impairment.” ... Inc. Designed by DANIEL CHEN.,2021-07-27,https://www.jpost.com/health-science/couples-desiring-to-conceive-should-vaccinate-against-covid-heres-why-674952,The Jerusalem Post,https://audiospace-1-u9912847.deta.app/getnewspic?id=6HN2dPzcHgBvfwd5vwjR1701422105.6541543,0.050194818
"Houthi leader, de facto Yemeni president, says not opposed to ...","“We affirm that we are not against the extension of the truce, but what is not possible is accepting any truce in which the ... Inc. Designed by DANIEL CHEN.",2022-05-24,https://www.jpost.com/middle-east/article-707513,The Jerusalem Post,https://audiospace-1-u9912847.deta.app/getnewspic?id=S7JD0dyPoun4h50hdiny1701422105.8428617,-0.253538533
Terms of Use,"This website (the “Site”) is operated by Bonneville International Corporation (“Operator”). ... affirm, represent and warrant that: (1) you own or otherwise...",2018-05-25,https://arizonasports.com/terms-of-use/,Arizona Sports,https://audiospace-1-u9912847.deta.app/getnewspic?id=TPeF6rxBTkUILt4edP0R1701422105.953112,0.13424713
"What Is Critical Race Theory, and Why Is It Under Attack?","This teaching approach seeks to affirm students' ethnic and racial backgrounds and is intellectually rigorous. ... ©2023 Editorial Projects in Education, Inc.",2021-05-18,https://www.edweek.org/leadership/what-is-critical-race-theory-and-why-is-it-under-attack/2021/05,Education Week,https://audiospace-1-u9912847.deta.app/getnewspic?id=z3RfaImlJNXT22YlMfpa1701422106.075115,-0.1999483656
Mailing List / Privacy Policy,Before you provide that information you will be given an opportunity to opt out of sharing your information and affirm you understand the purpose for sharing...,2023-02-06,https://knpr.org/mailing-list-privacy-policy,Nevada Public Radio,https://audiospace-1-u9912847.deta.app/getnewspic?id=m68rL8TKAZCeF4JLO7xe1701422106.2506983,0.467771937
Terms of Use,"Further, in connection with Content you submit, post, or display on or through the Products, you affirm ... Inc. (“Apple”) and that Apple has no responsibility...",2022-07-11,https://www.anthology.com/trust-center/terms-of-use,Anthology,https://audiospace-1-u9912847.deta.app/getnewspic?id=2PX2WSHt7pGsqu3Kfyk91701422106.4166327,0.13424713
Terms of Service,"By so doing, you affirm that you are either at least 18 years old, or an ... company or your site by the Project. You are granted a limited license to access...",2020-06-11,https://facethefactsusa.org/about/terms-of-service/,Face the Facts USA,https://audiospace-1-u9912847.deta.app/getnewspic?id=6AWyA5bgerqUeTAmwra31701422104.631601,-0.071533022
Introductory Remarks: Municipal Securities Disclosure ...,Company Filings · SEC Emblem · U.S. Securities and. Exchange Commission. q. About ... How can we affirm the importance of antifraud protections for investors...,2020-06-16,https://www.sec.gov/news/public-statement/peirce-remarks-municipal-securities-disclosure-conference-061620,SEC.gov,https://audiospace-1-u9912847.deta.app/getnewspic?id=MnVbG5cd4JHInD1QvOOj1701422104.7938814,0.17212616149999999
July | 2020,"... Inc., as UT's exclusive licensee, initiated to assert infringement of UT ... “On this record, we therefore affirm the district court's dismissal of Inline's...",2020-07-01,https://patentlyo.com/2020/07,Patently-O,https://audiospace-1-u9912847.deta.app/getnewspic?id=WUdOAEv5MPyuP1RkvaTe1701422104.9346995,0.0
About Iowa,"We affirm and celebrate all backgrounds and identities. We achieve ... Company Logo. Privacy Preference Center. When you visit any website, it may store or...",2020-05-26,https://uiowa.edu/about-iowa,The University of Iowa,https://audiospace-1-u9912847.deta.app/getnewspic?id=maL8VN69K4FEt5byzeok1701422104.9856422,0.0
June | 2015,"Quoting MGA, Inc. v. Gen. Motors Corp., 827 F.2d 729, 734 (Fed. Cir. 1987). In ... Thus we affirm that claim 1 is not directed to patent-eligible subject matter.",2015-06-30,https://patentlyo.com/2015/06,Patently-O,https://audiospace-1-u9912847.deta.app/getnewspic?id=Rv5YqlM4wGpF0nu4Oakw1701422105.0291078,0.0
Gordon Sondland Returns To Impeachment Inquiry As A Key ...,"It is now known that the statement was to affirm investigations that Trump ... company called Burisma. And in the last few days, another revelation...",2019-11-19,https://www.npr.org/2019/11/19/780801305/gordon-sondland-returns-to-impeachment-inquiry-as-a-key-witness-with-an-updated,NPR,https://audiospace-1-u9912847.deta.app/getnewspic?id=HDQ2LOvx7rnGhMwhH07F1701422105.0774708,0.12328226349999999
Oil Executives Grilled Over Industry's Role in Climate ...,"I want each of you to affirm that your organization will no longer spend any ... One company, she said, printed 1,500 pages from its own website. A...",2021-11-09,https://www.nytimes.com/2021/10/28/climate/oil-executives-house-disinformation-testimony.html,The New York Times,https://audiospace-1-u9912847.deta.app/getnewspic?id=IxTmIQVP0nQWULculTbm1701422105.144577,-0.071533022
